{
  "canonicalization": "json-sort-keys-compact-v1",
  "compatibility": {
    "a2a_otel_kit": {
      "evidence_runtime_version": "0.5.0",
      "evidence_tag": "v0.5.0",
      "evidence_tag_commit": "533b1b615c72d5814c482d84707ea83a2f2dd6cb",
      "relation": "descendant",
      "selected_commit": "a096766fd075868704276777d847c740a17ba821"
    },
    "governance": {
      "attested_path_count": 5,
      "attested_paths_digest": "b1afbd4af3870489291a600f519343473d3a5f12d224f3f5952616584834f5bd",
      "evidence_commit": "fd044430f39f860a2b67fedb2a425eeb7c073fcd",
      "relation": "squash_equivalent",
      "selected_commit": "74133daddc7b4a087ed8a7129dfa41d0ce50fecd"
    },
    "latest_runtime_evidence": "p1_9_governed_actuation",
    "limitation": "P1.9 records the Router decision source and behavior but does not persist the Policy Model Router Git commit; P2.0a therefore pins the selected Router source without claiming that the P1.9 report attests its exact commit.",
    "multi_agent_credit_desk": {
      "evidence_commit": "b326971bbe7910bd94bd45c0cafbaa11a03f8610",
      "relation": "exact",
      "selected_commit": "b326971bbe7910bd94bd45c0cafbaa11a03f8610"
    },
    "policy_model_router": {
      "evidence_binding": "not_attested_by_p1_9_report",
      "selected_commit": "0344f7410fa68fbd8a61fb5d949f5d4dcf0c9166"
    }
  },
  "components": {
    "a2a_otel_kit": {
      "commit": "a096766fd075868704276777d847c740a17ba821",
      "commit_timestamp": "2026-08-09T17:25:12-03:00",
      "integration_dependencies": {
        "a2a_otel_kit": null
      },
      "lockfile": {
        "path": "uv.lock",
        "sha256": "52dc56a86d48d614d9c309898cb64232dc22597fc37f87dd427dd294fcd89c2a",
        "size_bytes": 218866
      },
      "project_name": "a2a-otel-kit",
      "project_version": "0.6.0",
      "repository": "brunovicco/a2a-otel-kit",
      "requires_python": ">=3.13,<3.15"
    },
    "governance": {
      "commit": "74133daddc7b4a087ed8a7129dfa41d0ce50fecd",
      "commit_timestamp": "2026-08-09T23:13:31-03:00",
      "integration_dependencies": {
        "a2a_otel_kit": null
      },
      "lockfile": {
        "path": "uv.lock",
        "sha256": "5b81d5e73760c51dd68c311f3c7e4c73dff99092aee22b6a139b6961b1c5d35a",
        "size_bytes": 307260
      },
      "project_name": "verifiable-ai-governance-workspace",
      "project_version": "0.1.0",
      "repository": "brunovicco/verifiable-ai-governance",
      "requires_python": ">=3.12"
    },
    "multi_agent_credit_desk": {
      "commit": "b326971bbe7910bd94bd45c0cafbaa11a03f8610",
      "commit_timestamp": "2026-08-09T13:00:32-03:00",
      "integration_dependencies": {
        "a2a_otel_kit": "==0.5.0"
      },
      "lockfile": {
        "path": "uv.lock",
        "sha256": "3d8d976b4e4d3485cb27681b028d0feed0c314a32f62943a4aea810c53c988ef",
        "size_bytes": 218796
      },
      "project_name": "multi-agent-credit-desk",
      "project_version": "0.1.0",
      "repository": "brunovicco/multi-agent-credit-desk",
      "requires_python": ">=3.13,<3.15"
    },
    "policy_model_router": {
      "commit": "0344f7410fa68fbd8a61fb5d949f5d4dcf0c9166",
      "commit_timestamp": "2026-08-08T20:12:59-03:00",
      "integration_dependencies": {
        "a2a_otel_kit": "==0.4.2"
      },
      "lockfile": {
        "path": "uv.lock",
        "sha256": "6faa033bfd0807c6ea6ed98930dfba708f173c5d8a044ba9504350fdf475a69f",
        "size_bytes": 112462
      },
      "project_name": "policy-model-router",
      "project_version": "0.4.0",
      "repository": "brunovicco/policy-model-router",
      "requires_python": ">=3.13,<3.14"
    }
  },
  "database": {
    "alembic_head": "0019",
    "head_file": "apps/api/alembic/versions/0019_runtime_assurance_restore_workflow.py",
    "head_file_sha256": "0eb0caf7ceef9475e003452bc40895cea05d5c995733abb311eb6f2b0e923b9a",
    "migration_count": 19
  },
  "evidence": {
    "p1_7_runtime_telemetry": {
      "baselines": {
        "credit_desk_head": "b326971bbe7910bd94bd45c0cafbaa11a03f8610",
        "governance_head": "ca2998306404af0cf7539893764f69d94230a914"
      },
      "path": "artifacts/e2e/p1.7-cross-repo-telemetry-live-report.json",
      "result": "passed",
      "schema_version": "1.0",
      "sha256": "0ca10b222e810b7fcd90d59a5390fad0cc2c7907428da5e8d12828ac1b24ae57",
      "size_bytes": 2370
    },
    "p1_8_runtime_assurance": {
      "baselines": {
        "a2a_otel_kit_runtime_version": "0.5.0",
        "credit_desk_head": "b326971bbe7910bd94bd45c0cafbaa11a03f8610",
        "governance_head": "d69d827d6bfa47ea1f11743accd9c33df4c223e8",
        "required_governance_baseline": "d69d827d6bfa47ea1f11743accd9c33df4c223e8"
      },
      "path": "artifacts/e2e/p1.8-cross-repo-assurance-live-report.json",
      "result": "passed",
      "schema_version": "1.0",
      "sha256": "377fdafeefb084b8a6f205013610ba84fbb7240c62da91e217ee54e58bbb650f",
      "size_bytes": 7126
    },
    "p1_9_governed_actuation": {
      "baselines": {
        "a2a_otel_kit_runtime_version": "0.5.0",
        "credit_desk_head": "b326971bbe7910bd94bd45c0cafbaa11a03f8610",
        "governance_head": "fd044430f39f860a2b67fedb2a425eeb7c073fcd",
        "required_governance_baseline": "27212f0e04a138cfbb51601c1edf88e9964e74b1"
      },
      "path": "artifacts/e2e/p1.9-governed-actuation-live-report.json",
      "result": "passed",
      "schema_version": "1.0",
      "sha256": "755cb9631b864a04d2d73777aa2b4d5b9a1a01e2a7d40d63001ab3750e942402",
      "size_bytes": 15268
    }
  },
  "governance_provenance": {
    "control_catalog": {
      "path": "packages/policy-engine/src/policy_engine/control_catalog.yaml",
      "sha256": "465e2bf5e5187c1e79867782ed7627d883bf077145a1ef1ac76a44268aee7215",
      "size_bytes": 15835
    },
    "control_crosswalk": {
      "path": "packages/policy-engine/src/policy_engine/control_crosswalk.yaml",
      "sha256": "163ef73a785dd73b72dd1b1209202036133d2831e95dd6ea4ebfab3bc86ccb2c",
      "size_bytes": 16684
    },
    "policy_engine": {
      "path": "packages/policy-engine/src/policy_engine/engine.py",
      "sha256": "3d74fadd836fa6ccd7438ebcc8b51b6caccb71385574eff70970a61296c7a6e6",
      "size_bytes": 8580
    }
  },
  "kind": "verifiable-ai-governance/release-evidence-manifest",
  "manifest_digest": "ba55a969f86bd032c8f1babeb61e8831c58dd364ecbf29a6a5afcbda51f4c9bc",
  "release": {
    "source_date": "2026-08-09T23:13:31-03:00",
    "version": "0.2.0-rc1"
  },
  "schema_version": "1.0"
}
